Tweet,Date,Retweets,,,
RT @IvankaTrump: Touched by the warm hospitality of Prime Minister Abe and the Japanese people. ありがとうございます [Thank you]! Until next time 🇯🇵…,Sat Nov 04 12:10:41 +0000 2017,14547,,,
"Thank you to our GREAT Military/Veterans and @PacificCommand.

Remember #PearlHarbor. Remember the @USSArizona!

A… ",Sat Nov 04 07:08:25 +0000 2017,19367,,,
Thank you for such a beautiful welcome Hawaii. My great honor to visit @PacificCommand upon arrival. Heading to Pea… ,Sat Nov 04 03:07:20 +0000 2017,12768,,,
Getting ready to land in Hawaii. Looking so much forward to meeting with our great Military/Veterans at Pearl Harbor!,Fri Nov 03 22:44:39 +0000 2017,12737,,,
The decision on Sergeant Bergdahl is a complete and total disgrace to our Country and to our Military.,Fri Nov 03 16:54:59 +0000 2017,36394,,,
"JOBS, JOBS, JOBS! ",Fri Nov 03 16:22:11 +0000 2017,15813,,,
"The rigged Dem Primary, one of the biggest political stories in years, got ZERO coverage on Fake News Network TV last night. Disgraceful!",Fri Nov 03 16:09:52 +0000 2017,25448,,,
"Just took off for ceremony @ Pearl Harbor. Will then be heading to Japan, SKorea, China, Vietnam &amp; the Philippines. Will never let you down!",Fri Nov 03 14:45:56 +0000 2017,13648,,,
"I always felt I would be running and winning against Bernie Sanders, not Crooked H, without cheating, I was right.",Fri Nov 03 14:29:55 +0000 2017,16500,,,
Bernie Sanders supporters have every right to be apoplectic of the complete theft of the Dem primary by Crooked Hillary!,Fri Nov 03 14:28:34 +0000 2017,15988,,,
"...Based on that, the Military has hit ISIS much harder"" over the last two days. They will pay a big price for every attack on us!""",Fri Nov 03 12:11:33 +0000 2017,14913,,,
"ISIS just claimed the Degenerate Animal who killed, and so badly wounded, the wonderful people on the West Side, was their soldier."" .....""",Fri Nov 03 12:03:50 +0000 2017,14254,,,
"Pocahontas just stated that the Democrats, lead by the legendary Crooked Hillary Clinton, rigged the Primaries! Lets go FBI &amp; Justice Dept.",Fri Nov 03 11:55:29 +0000 2017,28441,,,
The real story on Collusion is in Donna B's new book. Crooked Hillary bought the DNC &amp; then stole the Democratic Primary from Crazy Bernie!,Fri Nov 03 11:48:10 +0000 2017,18553,,,
"....People are angry.  At some point the Justice Department, and the FBI, must do what is right and proper. The American public deserves it!",Fri Nov 03 11:11:33 +0000 2017,30194,,,
"...New Donna B book says she paid for and stole the Dem Primary. What about the deleted E-mails, Uranium, Podesta, the Server, plus, plus...",Fri Nov 03 11:03:59 +0000 2017,17837,,,
Everybody is asking why the Justice Department (and FBI) isn't looking into all of the dishonesty going on with Crooked Hillary &amp; the Dems..,Fri Nov 03 10:57:47 +0000 2017,23904,,,
My Twitter account was taken down for 11 minutes by a rogue employee. I guess the word must finally be getting out-and having an impact.,Fri Nov 03 10:51:51 +0000 2017,26904,,,
I will be interviewed by @IngrahamAngle on @FoxNews at 10:00. Enjoy!,Fri Nov 03 01:29:54 +0000 2017,7444,,,
The @TuckerCarlson opening statement about our once cherished and great FBI was so sad to watch. James Comey's leadership was a disaster!,Fri Nov 03 01:26:48 +0000 2017,16715,,,
....This is real collusion and dishonesty. Major violation of Campaign Finance Laws and Money Laundering - where is our Justice Department?,Fri Nov 03 00:48:09 +0000 2017,24794,,,
Donna Brazile just stated the DNC RIGGED the system to illegally steal the Primary from Bernie Sanders. Bought and paid for by Crooked H....,Fri Nov 03 00:39:57 +0000 2017,23730,,,
"Great Tax Cut rollout today. The lobbyists are storming Capital Hill, but the Republicans will hold strong and do what is right for America!",Fri Nov 03 00:05:07 +0000 2017,12926,,,
"Today, it was my pleasure and great honor to announce my nomination of Jerome Powell to be the next Chairman of the… ",Thu Nov 02 22:35:43 +0000 2017,9190,,,
"Broadcom's move to America=$20 BILLION of annual rev into U.S.A., $3+ BILLION/yr. in research/engineering &amp; $6 BILL… ",Thu Nov 02 20:33:18 +0000 2017,13721,,,
"Today, we are thrilled to welcome @Broadcom CEO Hock Tan to the WH to announce he is moving their HQ’s from Singapo… ",Thu Nov 02 19:58:56 +0000 2017,10391,,,
Congress must end chain migration so that we can have a system that is SECURITY BASED! We need to make AMERICA SAFE… ,Thu Nov 02 18:43:47 +0000 2017,13364,,,
I am calling on Congress to TERMINATE the diversity visa lottery program that presents significant vulnerabilities… ,Thu Nov 02 18:33:47 +0000 2017,17656,,,
"Congratulations to the Houston @Astros, 2017 #WorldSeries Champions⚾️#HoustonStrong #EarnHistory ",Thu Nov 02 17:31:32 +0000 2017,11264,,,
...There is also something appropriate about keeping him in the home of the horrible crime he committed. Should move fast. DEATH PENALTY!,Thu Nov 02 11:54:36 +0000 2017,16791,,,
Would love to send the NYC terrorist to Guantanamo but statistically that process takes much longer than going through the Federal system...,Thu Nov 02 11:50:46 +0000 2017,13600,,,
"NYC terrorist was happy as he asked to hang ISIS flag in his hospital room. He killed 8 people, badly injured 12. SHOULD GET DEATH PENALTY!",Thu Nov 02 03:43:18 +0000 2017,41934,,,
"Great mtg w/ @Cabinet today. Tomorrow, I will be announcing the new head of the Fed. I think you will be extremely… ",Thu Nov 02 03:21:56 +0000 2017,8000,,,
"Happy birthday to @garyplayer, a truly great Champion and Person!",Thu Nov 02 02:45:57 +0000 2017,4993,,,
It is finally happening for our great clean coal miners! ,Thu Nov 02 02:30:43 +0000 2017,10075,,,
The United States will be immediately implementing much tougher Extreme Vetting Procedures. The safety of our citizens comes first!,Thu Nov 02 02:19:44 +0000 2017,22438,,,
Just spoke to President Macri of Argentina about the five proud and wonderful men killed in the West Side terror attack. God be with them!,Thu Nov 02 02:09:21 +0000 2017,13395,,,
"CHAIN MIGRATION must end now! Some people come in, and they bring their whole family with them, who can be truly ev… ",Wed Nov 01 23:03:26 +0000 2017,22113,,,
@SenateMajLdr @SenateGOP ...and Appeals Court Judges at a record clip! Our courts are rapidly changing for the better!,Wed Nov 01 22:03:27 +0000 2017,6982,,,
Thanks to @SenateMajLdr McConnell and the @SenateGOP we are appointing high-quality Federal District...,Wed Nov 01 22:03:19 +0000 2017,8256,,,
"Thank you to the GREAT NYPD, First Responders and all govt officials for having handled the terrible West Side atta… ",Wed Nov 01 21:14:33 +0000 2017,11993,,,
@NYGovCuomo @NYCMayor ...fully supports any and all of their efforts with respect to the West Side attack. #NYCStrong,Wed Nov 01 20:14:27 +0000 2017,5264,,,
Just spoke with @NYGovCuomo and @NYCMayor de Blasio to let them know that the federal government...,Wed Nov 01 20:14:17 +0000 2017,6339,,,
We mourn the horrifying terrorist attack in NYC. All of America is praying and grieving for the families who lost t… ,Wed Nov 01 19:26:47 +0000 2017,12318,,,
....for the Middle Class. The House and Senate should consider ASAP as the process of final approval moves along. Push Biggest Tax Cuts EVER,Wed Nov 01 15:03:29 +0000 2017,11432,,,
Wouldn't it be great to Repeal the very unfair and unpopular Individual Mandate in ObamaCare and use those savings for further Tax Cuts.....,Wed Nov 01 14:59:43 +0000 2017,17144,,,
#NYCStrong #USA🇺🇸 ,Wed Nov 01 13:30:32 +0000 2017,8639,,,
"Senator Chuck Schumer helping to import Europes problems"" said Col.Tony Shaffer. We will stop this craziness!  @foxandfriends""",Wed Nov 01 11:40:14 +0000 2017,20751,,,
"We are fighting hard for Merit Based immigration, no more Democrat Lottery Systems. We must get MUCH tougher (and smarter).  @foxandfriends",Wed Nov 01 11:30:48 +0000 2017,25607,,,
The terrorist came into our country through what is called the Diversity Visa Lottery Program, a Chuck Schumer beauty. I want merit based.,Wed Nov 01 11:24:32 +0000 2017,36340,,
"I have just ordered Homeland Security to step up our already Extreme Vetting Program. Being politically correct is fine, but not for this!",Wed Nov 01 01:26:22 +0000 2017,36385,,,
The Republican House members are working hard (and late) toward the Massive Tax Cuts that they know you deserve. These will be biggest ever!,Wed Nov 01 01:22:20 +0000 2017,13355,,,
"My thoughts, condolences and prayers to the victims and families of the New York City terrorist attack. God and your country are with you!",Tue Oct 31 22:57:40 +0000 2017,25477,,,
"We must not allow ISIS to return, or enter, our country after defeating them in the Middle East and elsewhere. Enough!",Tue Oct 31 22:31:45 +0000 2017,35231,,,
"In NYC, looks like another attack by a very sick and deranged person. Law enforcement is following this closely. NOT IN THE U.S.A.!",Tue Oct 31 21:30:04 +0000 2017,24822,,,
"U.S. COAL PRODUCTION
Up📈7.8% past year. 
Down📉31.5% last 10 years. 
#EndingWarOnCoal ",Tue Oct 31 19:41:25 +0000 2017,10722,,,
“Home Prices Reach New All-Time Highs in August” Read more:  ,Tue Oct 31 19:14:31 +0000 2017,6369,,,
"Consumer Confidence Hits Highest Level Since December 2000"" Read more:  """,Tue Oct 31 18:11:11 +0000 2017,10198,,,
RT @IvankaTrump: We're working to make tax cuts &amp; the expanded Child Tax Credit a reality for American families. The time is now! #TaxRefor…,Tue Oct 31 16:55:14 +0000 2017,9502,,,
"Wishing everyone a safe and Happy Halloween!
#Halloween2017 ",Tue Oct 31 16:08:36 +0000 2017,13613,,,
Thank you @LuisRiveraMarin! ,Tue Oct 31 15:48:22 +0000 2017,5839,,,
“Statement by President Trump on the Apprehension of Mustafa al-Imam for His Alleged Role in Benghazi Attacks” ,Tue Oct 31 14:46:24 +0000 2017,9713,,,
"....earth shattering. He and his brother could Drain The Swamp, which would be yet another campaign promise fulfilled. Fake News weak!",Tue Oct 31 14:10:42 +0000 2017,12267,,,
"The biggest story yesterday, the one that has the Dems in a dither, is Podesta running from his firm. What he know about Crooked Dems is....",Tue Oct 31 14:06:27 +0000 2017,16834,,,
I hope people will start to focus on our Massive Tax Cuts for Business (jobs) and the Middle Class (in addition to Democrat corruption)!,Tue Oct 31 12:21:06 +0000 2017,16830,,,
"....came to the campaign. Few people knew the young, low level volunteer named George, who has already proven to be a liar. Check the DEMS!",Tue Oct 31 12:16:08 +0000 2017,12496,,,
"The Fake News is working overtime. As Paul Manaforts lawyer said, there was no collusion"" and events mentioned took place long before he...""",Tue Oct 31 12:09:41 +0000 2017,14091,,,
"....Also, there is NO COLLUSION!",Mon Oct 30 14:28:10 +0000 2017,22488,,,
"Sorry, but this is years ago, before Paul Manafort was part of the Trump campaign. But why aren't Crooked Hillary &amp; the Dems the focus?????",Mon Oct 30 14:25:09 +0000 2017,34581,,,
Great job by MichaelCaputo on @foxandfriends.,Mon Oct 30 11:50:26 +0000 2017,7542,,,
"Report out that Obama Campaign paid $972,000 to Fusion GPS. The firm also got $12,400,000 (really?) from DNC. Nobody knows who OK'd!",Mon Oct 30 11:37:36 +0000 2017,36239,,,
"All of this Russia"" talk right when the Republicans are making their big push for historic Tax Cuts &amp; Reform. Is this coincidental? NOT!""",Sun Oct 29 14:48:09 +0000 2017,23461,,,
"...are now fighting back like never before. There is so much GUILT by Democrats/Clinton, and now the facts are pouring out. DO SOMETHING!",Sun Oct 29 14:17:14 +0000 2017,25037,,,
"...the Uranium to Russia deal, the  33,000 plus deleted Emails, the Comey fix and so much more. Instead they look at phony Trump/Russia,....",Sun Oct 29 14:02:37 +0000 2017,23694,,,
"Never seen such Republican ANGER &amp; UNITY as I have concerning the lack of investigation on Clinton made Fake Dossier (now $12,000,000?),....",Sun Oct 29 13:53:43 +0000 2017,30087,,,
"As usual, the ObamaCare premiums will be up (the Dems own it), but we will Repeal &amp; Replace and have great Healthcare soon after Tax Cuts!",Sun Oct 29 13:12:47 +0000 2017,14188,,,
"JFK Files are released, long ahead of schedule!",Sat Oct 28 23:15:39 +0000 2017,19438,,,
While not at all presidential I must point out that the Sloppy Michael Moore Show on Broadway was a TOTAL BOMB and was forced to close. Sad!,Sat Oct 28 22:19:42 +0000 2017,25087,,,
"Happy #FirstRespondersDay to all of our HEROES out there. We are forever grateful to you for your service, sacrific… ",Sat Oct 28 22:08:30 +0000 2017,14756,,,
...in order to put any and all conspiracy theories to rest.,Sat Oct 28 21:10:36 +0000 2017,10509,,,
"...addresses of any mentioned person who is still living. I am doing this for reasons of full disclosure, transparency and...",Sat Oct 28 21:09:57 +0000 2017,10337,,,
"After strict consultation with General Kelly, the CIA and other Agencies, I will be releasing ALL #JFKFiles other than the names and...",Sat Oct 28 21:09:00 +0000 2017,16808,,,
Today is National Prescription Drug Take Back Day. Everyone can help fight the #OpioidEpidemic by participating!… ,Sat Oct 28 14:37:38 +0000 2017,8957,,,
Just read the nice remarks by President Jimmy Carter about me and how badly I am treated by the press (Fake News). Thank you Mr. President!,Sat Oct 28 12:28:28 +0000 2017,23692,,,
Very little reporting about the GREAT GDP numbers announced yesterday (3.0 despite the big hurricane hits). Best consecutive Q's in years!,Sat Oct 28 12:22:12 +0000 2017,20726,,,
"“WHAT HAPPENED”

“How Team Hillary played the press for fools on Russia”
➡️

NOW WE KNOW! ",Sat Oct 28 02:13:28 +0000 2017,25579,,,
#JFKFiles ,Sat Oct 28 00:05:45 +0000 2017,17483,,,
"Happy Birthday @TheLeeGreenwood!
#FlashbackFriday ",Fri Oct 27 23:33:14 +0000 2017,10053,,,
"People are anxiously awaiting my decision as to who the next head of the Fed will be....
🎥",Fri Oct 27 21:17:31 +0000 2017,8727,,,
.@FoxNews Chris Wallace: “More evidence of Dem collusion with Russia than GOP” ,Fri Oct 27 20:33:50 +0000 2017,13217,,,
We are inspired by the stories of everyday heroes who pull their communities from the depths of despair through lea… ,Fri Oct 27 18:16:35 +0000 2017,10062,,,
"Diane Black of Tennessee, the highly respected House Budget Committee Chairwoman, did a GREAT job in passing Budget, setting up big Tax Cuts",Fri Oct 27 14:52:42 +0000 2017,11825,,,
Thank you @FLGovScott. ,Fri Oct 27 14:33:15 +0000 2017,8073,,,
"It is now commonly agreed, after many months of COSTLY looking, that there was NO collusion between Russia and Trump. Was collusion with HC!",Fri Oct 27 13:33:40 +0000 2017,27525,,,
Happy birthday to the great @TheLeeGreenwood. You and your beautiful song have made such a difference. MAKE AMERICA GREAT AGAIN!,Fri Oct 27 12:50:47 +0000 2017,9888,,,
JFK Files are being carefully released. In the end there will be great transparency. It is my hope to get just about everything to public!,Fri Oct 27 11:38:43 +0000 2017,19385,,,
Good luck to @Joy_Villa on her decision to enter the wonderful world of politics. She has many fans!,Fri Oct 27 11:16:40 +0000 2017,10275,,,
"Congratulations to @SpeakerRyan, @GOPLeader, @SteveScalise and to the Republican Party on Budget passage yesterday. Now for biggest Tax Cuts",Fri Oct 27 11:09:03 +0000 2017,8751,,,
Thank you @foxandfriends. Really great job and show!,Fri Oct 27 10:59:56 +0000 2017,6999,,,
"Wacky &amp; totally unhinged Tom Steyer, who has been fighting me and my Make America Great Again agenda from beginning, never wins elections!",Fri Oct 27 10:58:36 +0000 2017,11473,,,
"WORKING TOGETHER, we will defeat this #OpioidEpidemic &amp; free our nation from the terrible affliction of drug abuse.… ",Fri Oct 27 01:18:55 +0000 2017,9939,,,
"Effective today, my administration officially declared the #OpioidCrisis a NATIONAL PUBLIC HEALTH EMERGENCY under f… ",Thu Oct 26 21:29:52 +0000 2017,13026,,,
Big news - Budget just passed!,Thu Oct 26 15:05:36 +0000 2017,24907,,,
Do not underestimate the UNITY within the Republican Party!,Thu Oct 26 14:30:45 +0000 2017,13077,,,
"Ed Gillespie will be a great Governor of Virginia. His opponent doesn't even show up to meetings/work, and will be VERY weak on crime!",Thu Oct 26 14:11:21 +0000 2017,11836,,,
"Ed Gillespie will turn the really bad Virginia economy #'s around, and fast. Strong on crime, he might even save our great statues/heritage!",Thu Oct 26 14:07:08 +0000 2017,13292,,,
RT @seanhannity: BOOM!!  Tick Tock ,Thu Oct 26 13:47:29 +0000 2017,12987,,,
Will be another Sean success! ,Thu Oct 26 13:45:45 +0000 2017,9193,,,
RT @PChowka: Fox News With Hannity's Help Regains Its Ratings Dominance By Peter Barry Chowka at The Hagmann report ,Thu Oct 26 13:44:05 +0000 2017,5702,,,
"Together, we will Make America Great Again!
#AmericaFirst🇺🇸 ",Thu Oct 26 03:33:41 +0000 2017,12898,,,
"This will be the biggest TAX CUT in the history of our country - and we need it! #TaxReform 
Read more:… ",Thu Oct 26 01:47:50 +0000 2017,11735,,,
RT @IvankaTrump: Working families need #TaxReform &amp; the time is now. This Administration is committed to ensuring all Americans can thrive…,Thu Oct 26 01:26:05 +0000 2017,9038,,,
Interview with @LouDobbs coming up at 7pmE on @FoxBusiness. Enjoy! ,Wed Oct 25 22:46:57 +0000 2017,5832,,,
"Texas @GovAbbott &amp; Lt. Gov. @DanPatrick,

Thank you for todays briefing on hurricane recovery efforts here in TX. K… ",Wed Oct 25 22:17:36 +0000 2017,7070,,,
The long anticipated release of the #JFKFiles will take place tomorrow. So interesting!,Wed Oct 25 19:56:39 +0000 2017,33368,,,
Melania and I look forward to being with President Xi &amp; Madame Peng Liyuan in China in two weeks for what will hope… ,Wed Oct 25 19:39:22 +0000 2017,8866,,,
"Spoke to President Xi of China to congratulate him on his extraordinary elevation. Also discussed NoKo &amp; trade, two very important subjects!",Wed Oct 25 19:24:10 +0000 2017,9682,,,
Just interviewed by @LouDobbs. Will be aired tonight at 7pmE on @FoxBusiness. #Dobbs,Wed Oct 25 17:46:10 +0000 2017,7642,,,
"Congrats to @Reince Priebus, a really good and talented man. We’re proud of you Reince! ",Wed Oct 25 17:19:31 +0000 2017,5918,,,
MAKE AMERICA GREAT AGAIN! ,Wed Oct 25 15:40:03 +0000 2017,13548,,,
"Working hard on the biggest tax cut in U.S. history. Great support from so many sides. Big winners will be the middle class, business &amp; JOBS",Wed Oct 25 11:35:16 +0000 2017,18542,,,
"The meeting with Republican Senators yesterday, outside of Flake and Corker, was a love fest with standing ovations and great ideas for USA!",Wed Oct 25 11:30:36 +0000 2017,11923,,,
"The reason Flake and Corker dropped out of the Senate race is very simple, they had zero chance of being elected. Now act so hurt &amp; wounded!",Wed Oct 25 11:27:36 +0000 2017,15177,,,
"Clinton campaign &amp; DNC paid for research that led to the anti-Trump Fake News Dossier. The victim here is the President."" @FoxNews""",Wed Oct 25 11:21:30 +0000 2017,22566,,,
So nice being with Republican Senators today. Multiple standing ovations! Most are great people who want big Tax Cuts and success for U.S.,Tue Oct 24 22:20:42 +0000 2017,16646,,,
"“President Donald J. Trump Proclaims October 24, 2017, as United Nations Day” Read more:  ",Tue Oct 24 19:11:38 +0000 2017,6544,,,
Stock Market just hit another record high! Jobs looking very good.,Tue Oct 24 14:35:32 +0000 2017,18844,,,
...the entire World WAS laughing and taking advantage of us. People like liddle' Bob Corker have set the U.S. way back. Now we move forward!,Tue Oct 24 14:20:46 +0000 2017,15018,,,
"Sen. Corker is the incompetent head of the Foreign Relations Committee, &amp; look how poorly the U.S. has done. He doesn't have a clue as.....",Tue Oct 24 14:13:48 +0000 2017,13996,,,
"Isn't it sad that lightweight Senator Bob Corker, who couldn't get re-elected in the Great State of Tennessee, will now fight Tax Cuts plus!",Tue Oct 24 13:30:21 +0000 2017,13876,,,
"...Corker dropped out of the race in Tennesse when I refused to endorse him, and now is only negative on anything Trump. Look at his record!",Tue Oct 24 12:20:35 +0000 2017,13302,,,
"Bob Corker, who helped President O give us the bad Iran Deal &amp; couldn't get elected dog catcher in Tennessee, is now fighting Tax Cuts....",Tue Oct 24 12:13:59 +0000 2017,20254,,,
We will never forget the 241 American service members killed by Hizballah in Beirut. They died in service to our na… ,Mon Oct 23 23:18:01 +0000 2017,17076,,,
"I had a very respectful conversation with the widow of Sgt. La David Johnson, and spoke his name from beginning, without hesitation!",Mon Oct 23 12:30:10 +0000 2017,16787,,,
"Two dozen NFL players continue to kneel during the National Anthem, showing total disrespect to our Flag &amp; Country.  No leadership in NFL!",Mon Oct 23 11:53:08 +0000 2017,24524,,,
"There will be NO change to your 401(k). This has always been a great and popular middle class tax break that works, and it stays!",Mon Oct 23 11:42:56 +0000 2017,24526,,,
"It is finally sinking through. 46% OF PEOPLE BELIEVE MAJOR NATIONAL NEWS ORGS FABRICATE STORIES ABOUT ME. FAKE NEWS, even worse! Lost cred.",Sun Oct 22 12:08:47 +0000 2017,27127,,,
"Wacky Congresswoman Wilson is the gift that keeps on giving for the Republican Party, a disaster for Dems. You watch her in action &amp; vote R!",Sun Oct 22 12:02:31 +0000 2017,23262,,,
Doing interview today with Maria Bartiromo at 10:00 A.M. on @FoxNews - ENJOY!,Sun Oct 22 11:50:39 +0000 2017,7728,,,
"...2nd Amendment, Strong Military, ISIS, historic VA improvement, Supreme Court Justice, Record Stock Market, lowest unemployment in 17 yrs!",Sun Oct 22 00:09:21 +0000 2017,16980,,,
"...9 months than this Administration. Over 50 Legislation approvals, massive regulation cuts, energy freedom, pipelines, border security....",Sun Oct 22 00:02:45 +0000 2017,15783,,,
"I agree getting Tax Cuts approved  is important (we will also get HealthCare), but perhaps no Administration has done more in its first.....",Sat Oct 21 23:57:41 +0000 2017,13389,,,
"Just out, but lightly reported: Fewest jobless claims since 1973 show firm U.S. Job Market"" Lowest since March 1973. @bpolitics""",Sat Oct 21 22:51:57 +0000 2017,16872,,,
"Crooked Hillary Clinton spent hundreds of millions of dollars more on Presidential Election than I did. Facebook was on her side, not mine!",Sat Oct 21 21:21:08 +0000 2017,22155,,,
"Officials behind the now discredited Dossier"" plead the Fifth. Justice Department and/or FBI should immediately release who paid for it.""",Sat Oct 21 19:59:23 +0000 2017,24700,,,
“Trump hails liberation of Raqqa as critical breakthrough in anti-ISIS campaign” ,Sat Oct 21 16:50:33 +0000 2017,10922,,,
Stock Market hits another all time high on Friday. 5.3 trillion dollars up since Election. Fake News doesn't spent much time on this!,Sat Oct 21 13:14:33 +0000 2017,20719,,,
People get what is going on! ,Sat Oct 21 13:08:17 +0000 2017,15474,,,
RT @IamVicky4Trump: TUNE IN: Maria Bartiromo Has an Exclusive Interview With President Trump ,Sat Oct 21 13:02:14 +0000 2017,5492,,,
"Subject to the receipt of further information, I will be allowing, as President, the long blocked and classified JFK FILES to be opened.",Sat Oct 21 12:35:05 +0000 2017,67813,,,
"I hope the Fake News Media keeps talking about Wacky Congresswoman Wilson in that she, as a representative, is killing the Democrat Party!",Sat Oct 21 12:07:16 +0000 2017,19659,,,
"Budget that just passed is a really big deal, especially in terms of what will be the biggest tax cut in U.S. history - MSM barely covered!",Sat Oct 21 11:52:56 +0000 2017,15217,,,
This is a once-in-a-generation opportunity to offer historic tax relief to the American people! Join me today:… ,Fri Oct 20 21:10:37 +0000 2017,15629,,,
"Today, it was an honor to have @UN
Secretary-General @AntonioGuterres at the @WhiteHouse. Speaking for the U.S.A.,… ",Fri Oct 20 18:50:21 +0000 2017,6997,,,
Thank you @GeraldoRivera @FoxandFriends. Agree! ,Fri Oct 20 18:31:19 +0000 2017,12867,,,
"Just out report: United Kingdom crime rises 13% annually amid spread of Radical Islamic terror."" Not good"," we must keep America safe!""",Fri Oct 20 10:31:50 +0000 2017,28773,,
"....This now allows for the passage of large scale Tax Cuts (and Reform), which will be the biggest in the history of our country!",Fri Oct 20 10:15:45 +0000 2017,14893,,,
"The Budget passed late last night, 51 to 49. We got ZERO Democrat votes with only Rand Paul (he will vote for Tax Cuts) voting against.....",Fri Oct 20 10:11:15 +0000 2017,15595,,,
Great news on the 2018 budget @SenateMajLdr McConnell - first step toward delivering MASSIVE tax cuts for the Ameri… ,Fri Oct 20 05:12:44 +0000 2017,12675,,,
Big ratings getter @seanhannity and Apprentice Champion John Rich are right now going on stage in Las Vegas for #VegasStrong. Great Show!,Fri Oct 20 03:00:42 +0000 2017,9622,,,
"The Fake News is going crazy with wacky Congresswoman Wilson(D), who was SECRETLY on a very personal call, and gave a total lie on content!",Fri Oct 20 02:53:42 +0000 2017,20438,,,
It was great to have Governor @RicardoRossello of #PuertoRico🇵🇷with us at the @WhiteHouse today. We are with you!… ,Thu Oct 19 20:40:21 +0000 2017,10731,,,
RT @USArmy333: @804StreetMedia @realDonaldTrump He’s done more in 9 months then obama did in8 yrs,Thu Oct 19 12:25:19 +0000 2017,8542,,,
".@foxandfriends Russia sent millions to Clinton Foundation""""",Thu Oct 19 12:21:18 +0000 2017,23212,,,
"Workers of firm involved with the discredited and Fake Dossier take the 5th. Who paid for it, Russia, the FBI or the Dems (or all)?",Thu Oct 19 11:56:15 +0000 2017,26333,,,
"Uranium deal to Russia, with Clinton help and Obama Administration knowledge, is the biggest story that Fake Media doesn't want to follow!",Thu Oct 19 11:17:52 +0000 2017,40286,,,
