Tweet,Date,Retweets,,,
"Looking forward to RALLY in the Great State of Pennsylvania tonight at 7:30. Big crowd, big energy!",Sat Apr 29 15:35:26 +0000 2017,9942,,,
".@LouDobbs just stated that President Trump's successes are unmatched in recent presidential history""  Thank you Lou!""",Sat Apr 29 02:40:11 +0000 2017,14612,,,
"North Korea disrespected the wishes of China &amp; its highly respected President when it launched, though unsuccessfully, a missile today. Bad!",Fri Apr 28 23:26:18 +0000 2017,22464,,,
I will be interviewed by @MarthaMaccallum on @FoxNews tonight at 7pm. Enjoy!,Fri Apr 28 22:31:25 +0000 2017,5103,,,
"We are making tremendous progress with the V. A. There has never been so much done so quickly, and we have just started. We love our VETS!",Fri Apr 28 12:15:59 +0000 2017,15171,,,
"RT @foxandfriends: Former President Obama's $400K Wall Street speech stuns liberal base; Sen. Warren saying she was troubled by that"" """,Fri Apr 28 12:12:15 +0000 2017,8570,,,
"Today, I signed an Executive Order on Improving Accountability and Whistleblower Protection at the @DeptVetAffairs:… ",Thu Apr 27 22:43:19 +0000 2017,10579,,,
"Presidential Memorandum for the @CommerceGov, @SecretaryRoss re: Aluminum Imports and Threats to National Security:… ",Thu Apr 27 21:42:47 +0000 2017,5780,,,
.@FLOTUS Melania and I were honored to welcome Argentina President @MauricioMacri and First Lady Juliana Awada to t… ,Thu Apr 27 18:59:31 +0000 2017,11604,,,
As families prepare for summer vacations in our National Parks - Democrats threaten to close them and shut down the government. Terrible!,Thu Apr 27 14:39:25 +0000 2017,14507,,,
Democrats used to support border security — now they want illegals to pour through our borders.,Thu Apr 27 14:39:04 +0000 2017,13696,,,
Democrats jeopardizing the safety of our troops to bail out their donors from insurance companies. It is time to put #AmericaFirst🇺🇸,Thu Apr 27 14:38:14 +0000 2017,11542,,,
What's more important? Rebuilding our military - or bailing out insurance companies? Ask the Democrats.,Thu Apr 27 14:37:51 +0000 2017,13300,,,
I promise to rebuild our military and secure our border. Democrats want to shut down the government. Politics!,Thu Apr 27 14:37:30 +0000 2017,12673,,,
I want to help our miners while the Democrats are blocking their healthcare.,Thu Apr 27 14:37:09 +0000 2017,9388,,,
The Democrats want to shut government if we don't bail out Puerto Rico and give billions to their insurance companies for OCare failure. NO!,Thu Apr 27 11:30:20 +0000 2017,17230,,,
"...subject to the fact that if we do not reach a fair deal for all, we will then terminate NAFTA. Relationships are good-deal very possible!",Thu Apr 27 11:21:20 +0000 2017,9788,,,
I received calls from the President of Mexico and the Prime Minister of Canada asking to renegotiate NAFTA rather than terminate. I agreed..,Thu Apr 27 11:12:12 +0000 2017,15485,,,
"Democrats are trying to bail out insurance companies from disastrous #ObamaCare, and Puerto Rico with your tax dollars. Sad!",Wed Apr 26 23:06:16 +0000 2017,14975,,,
"A great great honor to welcome &amp; recognize the National Teacher of the Year, as well as the Teacher of the Year fro… ",Wed Apr 26 22:27:29 +0000 2017,9312,,,
"Today, I signed an Executive Order on Enforcing Statutory Prohibitions on Federal Control of Education. EO:… ",Wed Apr 26 20:49:16 +0000 2017,8778,,,
"Today, I signed an Executive Order @ the U.S. Dept. of @Interior: 'Review of Designations Under the Antiquities Act… ",Wed Apr 26 18:10:04 +0000 2017,6936,,,
"HAPPY BIRTHDAY to our @FLOTUS, Melania! 
 ",Wed Apr 26 14:53:26 +0000 2017,17542,,,
The U.S. recorded its slowest economic growth in five years (2016). GDP up only 1.6%. Trade deficits hurt the economy very badly.,Wed Apr 26 10:51:06 +0000 2017,9061,,,
"...the Ninth Circuit, which has a terrible record of being overturned (close to 80%). They used to call this judge shopping!"" Messy system.""",Wed Apr 26 10:38:51 +0000 2017,12148,,,
"Out of our very big country, with many choices, does everyone notice that both the ban"" case and now the ""sanctuary"" case is brought in ...""",Wed Apr 26 10:30:54 +0000 2017,10009,,,
First the Ninth Circuit rules against the ban &amp; now it hits again on sanctuary cities-both ridiculous rulings. See you in the Supreme Court!,Wed Apr 26 10:20:00 +0000 2017,17165,,,
"'Presidential Executive Order on Promoting Agriculture and Rural Prosperity in America'
Executive Order:… ",Tue Apr 25 23:32:13 +0000 2017,8604,,,
"Remarks at the United States Holocaust Memorial Museum's National Days of Remembrance. 
Full remarks:… ",Tue Apr 25 17:51:03 +0000 2017,7251,,,
"Don't let the fake media tell you that I have changed my position on the WALL. It will get built and help stop drugs, human trafficking etc.",Tue Apr 25 12:36:28 +0000 2017,25355,,,
Canada has made business for our dairy farmers in Wisconsin and other border states very difficult. We will not stand for this. Watch!,Tue Apr 25 12:30:15 +0000 2017,13931,,,
Proud of @IvankaTrump for her leadership on these important issues. Looking forward to hearing her speak at the W20! ,Tue Apr 25 11:23:08 +0000 2017,6459,,,
"Today, I signed the Holocaust Remembrance Proclamation:  #ICYMI- My statement last night at… ",Mon Apr 24 20:32:08 +0000 2017,10054,,,
"If our healthcare plan is approved, you will see real healthcare and premiums will start tumbling down. ObamaCare is in a death spiral!",Mon Apr 24 17:18:32 +0000 2017,13118,,,
Join me in congratulating @NASA's @AstroPeggy by using the hashtag #CongratsPeggy! Earlier today:… ,Mon Apr 24 17:11:31 +0000 2017,7233,,,
"....the wall is not built, which it will be, the drug situation will NEVER be fixed the way it should be!
#BuildTheWall",Mon Apr 24 15:31:57 +0000 2017,7744,,,
The Wall is a very important tool in stopping drugs from pouring into our country and poisoning our youth (and many others)! If,Mon Apr 24 12:28:01 +0000 2017,10934,,,
"The two fake news polls released yesterday, ABC &amp; NBC, while containing some very positive info, were totally wrong in General E. Watch!",Mon Apr 24 12:15:45 +0000 2017,8653,,,
...popular vote. ABC News/Washington Post Poll (wrong big on election) said almost all stand by their vote on me &amp; 53% said strong leader.,Sun Apr 23 19:55:04 +0000 2017,11549,,,
New polls out today are very good considering that much of the media is FAKE and almost always negative. Would still beat Hillary in .....,Sun Apr 23 19:48:16 +0000 2017,11304,,,
"Eventually, but at a later date so we can get started early, Mexico will be paying, in some form, for the badly needed border wall.",Sun Apr 23 15:44:59 +0000 2017,14479,,,
The Democrats don't want money from budget going to border wall despite the fact that it will stop drugs and very bad MS 13 gang members.,Sun Apr 23 15:42:07 +0000 2017,15707,,,
ObamaCare is in serious trouble. The Dems need big money to keep it going - otherwise it dies far sooner than anyone would have thought.,Sun Apr 23 14:20:12 +0000 2017,11835,,,
"Thank you Lake Worth, Florida. @foxandfriends",Sun Apr 23 14:07:52 +0000 2017,4692,,,
Very interesting election currently taking place in France.,Sun Apr 23 14:05:07 +0000 2017,16332,,,
I am committed to keeping our air and water clean but always remember that economic growth enhances environmental protection. Jobs matter!,Sat Apr 22 21:49:10 +0000 2017,17497,,,
"Today on Earth Day, we celebrate our beautiful forests, lakes and land. We stand committed to preserving the natural beauty of our nation.",Sat Apr 22 19:01:59 +0000 2017,14139,,,
Big TAX REFORM AND TAX REDUCTION will be announced next Wednesday.,Sat Apr 22 16:15:01 +0000 2017,16190,,,
Next Saturday night I will be holding a BIG rally in Pennsylvania. Look forward to it!,Sat Apr 22 16:10:26 +0000 2017,11391,,,
Getting ready to visit Walter Reed Medical Center with Melania. Looking forward to seeing our bravest and greatest Americans!,Sat Apr 22 16:05:37 +0000 2017,10111,,,
RT @foxandfriends: Israeli PM Netanyahu praises U.S. policy changes during meeting with Defense. Sec Mattis ,Sat Apr 22 15:18:49 +0000 2017,5224,,,
"RT @foxandfriends: Chicago approves new plan to hide illegal immigrants from the feds, plus give them access to city services ",Sat Apr 22 15:18:11 +0000 2017,7000,,,
"After 5 SB victories since 2002, it was my honor to give Bob Kraft, Coach Belichick, and the players their first to… ",Sat Apr 22 03:38:00 +0000 2017,10083,,,
"'Presidential Executive Order on Identifying and Reducing Tax Regulatory Burdens' 
Executive Order:… ",Sat Apr 22 00:43:21 +0000 2017,9524,,,
"RT @Scavino45: .@POTUS @realDonaldTrump, @IvankaTrump, Jared Kushner, &amp; Dina Powell in the Oval Office today w/ Aya &amp; her brother Basel.
#W…",Sat Apr 22 00:19:58 +0000 2017,4795,,,
"WELCOME HOME, AYA!
#GodBlessTheUSA🇺🇸 ",Fri Apr 21 20:22:14 +0000 2017,18939,,,
"China is very much the economic lifeline to North Korea so, while nothing is easy, if they want to solve the North Korean problem, they will",Fri Apr 21 13:04:19 +0000 2017,13908,,,
"No matter how much I accomplish during the ridiculous standard of the first 100 days, &amp; it has been a lot (including S.C.), media will kill!",Fri Apr 21 10:50:33 +0000 2017,14249,,,
Another terrorist attack in Paris. The people of France will not take much more of this. Will have a big effect on presidential election!,Fri Apr 21 10:32:01 +0000 2017,17959,,,
RT @foxandfriends: NYT editor apologizes for misleading tweet about New England Patriots' visit to the White House (via @FoxFriendsFirst) h…,Fri Apr 21 10:11:27 +0000 2017,8156,,,
A great honor to host PM Paolo Gentiloni of Italy at the White House this afternoon! #ICYMI- Joint Press Conference… ,Thu Apr 20 21:35:05 +0000 2017,6805,,,
"We're going to use American steel, we're going to use American labor, we are going to come first in all deals. ➡️… ",Thu Apr 20 19:33:46 +0000 2017,11350,,,
"Failing @nytimes, which has been calling me wrong for two years, just got caught in a big lie concerning New England Patriots visit to W.H.",Thu Apr 20 13:48:14 +0000 2017,18434,,,
A great honor to host the @SuperBowl Champion New England @Patriots at the White House today. Congratulations!… ,Thu Apr 20 01:34:10 +0000 2017,9414,,,
"Today I signed the Veterans (OUR HEROES) Choice Program Extension &amp; Improvement Act @ the @WhiteHouse. #S544 
Watch… ",Wed Apr 19 20:26:45 +0000 2017,10241,,,
#BuyAmericanHireAmerican🇺🇸 ,Wed Apr 19 17:31:28 +0000 2017,12484,,,
Dems failed in Kansas and are now failing in Georgia. Great job Karen Handel! It is now Hollywood vs. Georgia on June 20th.,Wed Apr 19 12:43:18 +0000 2017,14988,,,
"Despite major outside money, FAKE media support and eleven Republican candidates, BIG R"" win with runoff in Georgia. Glad to be of help!""",Wed Apr 19 04:09:17 +0000 2017,14737,,,
"#BuyAmericanHireAmerican🇺🇸
Watch➡️ ",Tue Apr 18 20:56:16 +0000 2017,6566,,,
"Just learned that Jon @Ossoff, who is running for Congress in Georgia, doesn't even live in the district. Republicans, get out and vote!",Tue Apr 18 20:38:25 +0000 2017,15889,,,
Republicans must get out today and VOTE in Georgia 6. Force runoff and easy win! Dem Ossoff will raise your taxes-very bad on crime &amp; 2nd A.,Tue Apr 18 10:46:19 +0000 2017,15477,,,
"Democrat Jon Ossoff would be a disaster in Congress. VERY weak on crime and illegal immigration, bad for jobs and wants higher taxes. Say NO",Tue Apr 18 10:38:59 +0000 2017,13808,,,
I will be interviewed on @foxandfriends by @ainsleyearhardt starting at 6:00 A.M. Enjoy!,Tue Apr 18 09:48:10 +0000 2017,4519,,,
The weak illegal immigration policies of the Obama Admin. allowed bad MS 13 gangs to form in cities across U.S. We are removing them fast!,Tue Apr 18 09:39:25 +0000 2017,17030,,,
"With eleven Republican candidates running in Georgia (on Tuesday) for Congress, a runoff will be a win. Vote R"" for lower taxes &amp; safety!""",Tue Apr 18 02:18:38 +0000 2017,13148,,,
"See you tomorrow Wisconsin!

'Trump spurs small-business optimism in Milwaukee area'
",Mon Apr 17 22:41:53 +0000 2017,8039,,,
"TRUMP APPROVAL HITS 50%
",Mon Apr 17 22:38:30 +0000 2017,10392,,,
RT @DRUDGE_REPORT: TRUMP APPROVAL HITS 50% ,Mon Apr 17 13:35:27 +0000 2017,7353,,,
"The super Liberal Democrat in the Georgia Congressioal race tomorrow wants to protect criminals, allow illegal immigration and raise taxes!",Mon Apr 17 13:31:03 +0000 2017,18657,,,
The Fake Media (not Real Media) has gotten even worse since the election. Every story is badly slanted. We have to hold them to the truth!,Mon Apr 17 12:17:59 +0000 2017,17859,,,
"A great book for your reading enjoyment: REASONS TO VOTE FOR DEMOCRATS"" by Michael J. Knowles.""",Mon Apr 17 12:13:17 +0000 2017,12060,,,
"The first 90 days of my presidency has exposed the total failure of the last eight years of foreign policy!"" So true. @foxandfriends""",Mon Apr 17 12:07:16 +0000 2017,15561,,,
"The recent Kansas election (Congress) was a really big media event, until the Republicans won. Now they play the same game with Georgia-BAD!",Mon Apr 17 00:45:01 +0000 2017,12356,,,
"Our military is building and is rapidly becoming stronger than ever before. Frankly, we have no choice!",Sun Apr 16 13:41:47 +0000 2017,19918,,,
Someone should look into who paid for the small organized rallies yesterday. The election is over!,Sun Apr 16 13:13:26 +0000 2017,20005,,,
I did what was an almost an impossible thing to do for a Republican-easily won the Electoral College! Now Tax Returns are brought up again?,Sun Apr 16 13:07:11 +0000 2017,11864,,,
Happy Easter to everyone!,Sun Apr 16 12:24:49 +0000 2017,38952,,,
Why would I call China a currency manipulator when they are working with us on the North Korean problem? We will see what happens!,Sun Apr 16 12:18:40 +0000 2017,14405,,,
RT @FLOTUS: Looking forward to hosting the annual Easter Egg Roll at the @WhiteHouse on Monday! ,Fri Apr 14 21:46:20 +0000 2017,17249,,,
Weekly Address-  ,Fri Apr 14 20:41:25 +0000 2017,6858,,,
RT @DRUDGE_REPORT: GREAT AGAIN: FEDS ARREST MURDER SUSPECT IN 'FAST AND FURIOUS' SCANDAL... ,Fri Apr 14 03:18:24 +0000 2017,5607,,,
It was a great honor to welcome Atlanta's heroic first responders to the White House this afternoon! ,Thu Apr 13 19:21:07 +0000 2017,12572,,,
Things will work out fine between the U.S.A. and Russia. At the right time everyone will come to their senses &amp; there will be lasting peace!,Thu Apr 13 13:16:30 +0000 2017,23385,,,
"I have great confidence that China will properly deal with North Korea. If they are unable to do so, the U.S., with its allies, will! U.S.A.",Thu Apr 13 13:08:20 +0000 2017,27192,,,
"Jobs are returning, illegal immigration is plummeting, law, order and justice are being restored. We are truly making America great again!",Thu Apr 13 00:32:25 +0000 2017,29817,,,
"One by one we are keeping our promises - on the border, on energy, on jobs, on regulations. Big changes are happening!",Wed Apr 12 23:10:37 +0000 2017,17169,,,
Economic confidence is soaring as we unleash the power of private sector job creation and stand up for the American Workers. #AmericaFirst,Wed Apr 12 23:09:56 +0000 2017,11724,,,
Great meeting w/ NATO Sec. Gen. We agreed on the importance of getting countries to pay their fair share &amp; focus on… ,Wed Apr 12 21:48:48 +0000 2017,10362,,,
"Great win in Kansas last night for Ron Estes, easily winning the Congressional race against the Dems, who spent heavily &amp; predicted victory!",Wed Apr 12 12:37:07 +0000 2017,12727,,,
Had a very good call last night with the President of China concerning the menace of North Korea.,Wed Apr 12 12:22:22 +0000 2017,18848,,,
I will be interviewed by @MariaBartiromo at 6:00 A.M. @FoxBusiness. Enjoy!,Wed Apr 12 03:16:00 +0000 2017,6016,,,
Great Strategic &amp; Policy CEO Forum today with my Cabinet Secretaries and top CEO's from around the United States.… ,Tue Apr 11 20:27:35 +0000 2017,8430,,,
"Ron Estes is running TODAY for Congress in the Great State of Kansas. A wonderful guy, I need his help on Healthcare &amp; Tax Cuts (Reform).",Tue Apr 11 12:59:20 +0000 2017,11875,,,
"North Korea is looking for trouble. If China decides to help, that would be great. If not, we will solve the problem without them!  U.S.A.",Tue Apr 11 12:03:43 +0000 2017,51188,,,
I explained to the President of China that a trade deal with the U.S. will be far better for them if they solve the North Korean problem!,Tue Apr 11 11:59:04 +0000 2017,18459,,,
"Happy Passover to everyone celebrating in the United States of America, Israel, and around the world. #ChagSameach",Mon Apr 10 23:56:35 +0000 2017,16118,,,
Congratulations to Justice Neil Gorsuch on his elevation to the United States Supreme Court. A great day for Americ… ,Mon Apr 10 21:59:10 +0000 2017,15231,,,
Thank you @USNavy! #USA ,Mon Apr 10 01:35:45 +0000 2017,14012,,,
...confidence that President Al Sisi will handle situation properly.,Sun Apr 09 15:21:07 +0000 2017,10054,,,
So sad to hear of the terrorist attack in Egypt. U.S. strongly condemns. I have great...,Sun Apr 09 15:20:39 +0000 2017,15124,,,
Judge Gorsuch will be sworn in at the Rose Garden of the White House on Monday at 11:00 A.M. He will be a great Justice. Very proud of him!,Sat Apr 08 19:58:32 +0000 2017,17911,,,
The reason you don't generally hit runways is that they are easy and inexpensive to quickly fix (fill in and top)!,Sat Apr 08 19:00:08 +0000 2017,11219,,,
"Congratulations to our great military men and women for representing the United States, and the world, so well in the Syria attack.",Sat Apr 08 14:54:24 +0000 2017,26383,,,
"...goodwill and friendship was formed, but only time will tell on trade.",Sat Apr 08 14:51:10 +0000 2017,6993,,,
It was a great honor to have President Xi Jinping and Madame Peng Liyuan of China as our guests in the United States. Tremendous...,Sat Apr 08 14:50:59 +0000 2017,10185,,,
RT @IvankaTrump: Very proud of Arabella and Joseph for their performance in honor of President Xi Jinping and Madame Peng Liyuan's official…,Fri Apr 07 23:22:53 +0000 2017,14759,,,
"It was an honor to host our American heroes from the @WWP #SoldierRideDC at the @WhiteHouse today with @FLOTUS, @VP… ",Thu Apr 06 18:30:49 +0000 2017,10442,,,
"JOBS, JOBS, JOBS!
 ",Thu Apr 06 02:12:43 +0000 2017,22210,,,
I am deeply committed to preserving our strong relationship &amp; to strengthening America's long-standing support for… ,Wed Apr 05 21:18:08 +0000 2017,12709,,,
Great to talk jobs with #NABTU2017. Tremendous spirit &amp; optimism - we will deliver! ,Tue Apr 04 21:03:51 +0000 2017,8889,,,
Thank you Sean McGarvey &amp; the entire Governing Board of Presidents for honoring me w/an invite to speak. #NABTU2017… ,Tue Apr 04 19:38:59 +0000 2017,9169,,,
".@WhiteHouse #CEOTownHall
➡️ ",Tue Apr 04 18:38:13 +0000 2017,8146,,,
RT @DRUDGE_REPORT: RICE ORDERED SPY DOCS ON TRUMP? ,Tue Apr 04 12:39:16 +0000 2017,11035,,,
It was an honor to welcome President Al Sisi of Egypt to the @WhiteHouse as we renew the historic partnership betwe… ,Mon Apr 03 19:39:05 +0000 2017,12845,,,
Looking forward to hosting our heroes from the Wounded Warrior Project (@WWP) Soldier Ride to the @WhiteHouse on Th… ,Mon Apr 03 17:56:55 +0000 2017,10700,,,
"Getting ready to meet President al-Sisi of Egypt. On behalf of the United States, I look forward to a long and wonderful relationship.",Mon Apr 03 16:00:33 +0000 2017,12443,,,
Did Hillary Clinton ever apologize for receiving the answers to the debate? Just asking!,Mon Apr 03 11:21:11 +0000 2017,26249,,,
Was the brother of John Podesta paid big money to get the sanctions on Russia lifted? Did Hillary know?,Mon Apr 03 11:16:52 +0000 2017,22456,,,
"Such amazing reporting on unmasking and the crooked scheme against us by @foxandfriends. Spied on before nomination."" The real story.""",Mon Apr 03 10:15:17 +0000 2017,19130,,,
"Melania and I are honored to light up the @WhiteHouse this evening, for 
#WorldAutismAwarenessDay. Join us &amp; #LIUB.… ",Mon Apr 03 00:58:29 +0000 2017,24421,,,
The real story turns out to be SURVEILLANCE and LEAKING! Find the leakers.,Sun Apr 02 13:34:16 +0000 2017,20606,,,
"Talks on Repealing and Replacing ObamaCare are, and have been, going on, and will continue until such time as a deal is hopefully struck.",Sun Apr 02 13:03:43 +0000 2017,13219,,,
Anybody (especially  Fake News media) who thinks that Repeal &amp; Replace of ObamaCare is dead does not know the love and strength in R Party!,Sun Apr 02 12:56:49 +0000 2017,15814,,,
Thank you @JCLayfield -- will get even better as my Administration continues to put #AmericaFirst🇺🇸 ,Sat Apr 01 22:21:02 +0000 2017,13293,,,
"Wow, @FoxNews just reporting big news. Source: Official behind unmasking is high up. Known Intel official is responsible. Some unmasked....""",Sat Apr 01 16:50:36 +0000 2017,15551,,,
"It is the same Fake News Media that said there is no path to victory for Trump"" that is now pushing the phony Russia story. A total scam!""",Sat Apr 01 13:02:32 +0000 2017,21335,,,
When will Sleepy Eyes Chuck Todd and @NBCNews start talking about the Obama SURVEILLANCE SCANDAL and stop with the Fake Trump/Russia story?,Sat Apr 01 12:43:32 +0000 2017,20816,,,
We are going to defend our industry &amp; create a level playing field for the American worker. It is time to put… ,Fri Mar 31 21:31:44 +0000 2017,14104,,,
'Trump Celebrates American Manufacturing Survey Showing Highest Level of Optimism in 20 Years' ➡️… ,Fri Mar 31 19:37:00 +0000 2017,9319,,,
"It is an exciting time for our country!
#WeeklyAddress #ConfirmGorsuch ",Fri Mar 31 18:30:38 +0000 2017,13245,,,
#ConfirmGorsuch #SCOTUS ,Fri Mar 31 17:45:10 +0000 2017,10610,,,
"Great meeting with a wonderful woman today, former Secretary of State, Condoleezza Rice! #USA🇺🇸 ",Fri Mar 31 17:28:44 +0000 2017,10126,,,
"It was an honor to welcome the Prime Minister of Denmark, Lars Løkke Rasmussen {@larsloekke} to the @WhiteHouse yes… ",Fri Mar 31 14:35:47 +0000 2017,6684,,,
"Mike Flynn should ask for immunity in that this is a witch hunt (excuse for big election loss), by media &amp; Dems, of historic proportion!",Fri Mar 31 11:04:32 +0000 2017,18307,,,
Only by enlisting the full potential of women in our society will we be truly able to #MakeAmericaGreatAgain🇺🇸… ,Fri Mar 31 01:43:35 +0000 2017,13053,,,
...and job losses. American companies must be prepared to look at other alternatives.,Thu Mar 30 22:16:50 +0000 2017,7296,,,
The meeting next week with China will be a very difficult one in that we can no longer have massive trade deficits...,Thu Mar 30 22:16:17 +0000 2017,11704,,,
"Where are @RepMarkMeadows, @Jim_Jordan and @Raul_Labrador?
#RepealANDReplace #Obamacare",Thu Mar 30 21:21:50 +0000 2017,5697,,,
"If @RepMarkMeadows, @Jim_Jordan and @Raul_Labrador would get on board we would have both great healthcare and massive tax cuts &amp; reform.",Thu Mar 30 21:20:44 +0000 2017,7482,,,
Great op-ed from @RepKenBuck. Looks like some in the Freedom Caucus are helping me end #Obamacare. ,Thu Mar 30 21:17:30 +0000 2017,6444,,,
The failing @nytimes has disgraced the media world. Gotten me wrong for two solid years. Change libel laws? ,Thu Mar 30 14:27:14 +0000 2017,12629,,,
"The Freedom Caucus will hurt the entire Republican agenda if they don't get on the team, &amp; fast. We must fight them, &amp; Dems, in 2018!",Thu Mar 30 13:07:42 +0000 2017,13151,,,
"Today we honored our true American heroes on the first-ever National Vietnam War Veterans Day.
#ThankAVeteran… ",Thu Mar 30 02:12:09 +0000 2017,16269,,,
.@FLOTUS Melania and I were honored to stop by the Women's Empowerment  Panel this afternoon at the @WhiteHouse.… ,Wed Mar 29 23:58:11 +0000 2017,10075,,,
Today's EO established a commission on combating drug addiction and the opioid crisis. Watch listening session➡️… ,Wed Mar 29 21:39:01 +0000 2017,8378,,,
If the people of our great country could only see how viciously and inaccurately my administration is covered by certain media!,Wed Mar 29 12:21:02 +0000 2017,19575,,,
"Remember when the failing @nytimes apologized to its subscribers, right after the election, because their coverage was so wrong. Now worse!",Wed Mar 29 12:01:52 +0000 2017,15043,,,
Why doesn't Fake News talk about Podesta ties to Russia as covered by @FoxNews or money from Russia to Clinton - sale of  Uranium?,Tue Mar 28 22:41:09 +0000 2017,25535,,,
"A NEW ERA IN AMERICAN ENERGY! 
#MadeInTheUSA🇺🇸
Watch here:  ",Tue Mar 28 21:48:40 +0000 2017,9314,,,
It was an honor to welcome @GLFOP to the @WhiteHouse today with @VP Pence &amp; Attorney General Sessions. THANK YOU fo… ,Tue Mar 28 20:57:17 +0000 2017,6869,,,
"The failing @NYTimes would do much better if they were honest! 
",Tue Mar 28 15:26:23 +0000 2017,12531,,,
Watch @foxandfriends now on Podesta and Russia!,Tue Mar 28 11:16:44 +0000 2017,8954,,,
Big announcement by Ford today. Major investment to be made in three Michigan plants. Car companies coming back to U.S.  JOBS! JOBS! JOBS!,Tue Mar 28 10:36:02 +0000 2017,22497,,,
"The Democrats will make a deal with me on healthcare as soon as ObamaCare folds - not long. Do not worry, we are in very  good shape!",Tue Mar 28 02:03:17 +0000 2017,15499,,,
The Republican House Freedom Caucus was able to snatch defeat from the jaws of victory. After so many bad years they were ready for a win!,Tue Mar 28 01:41:15 +0000 2017,9274,,,
"Why isn't the House Intelligence Committee looking into the Bill &amp; Hillary deal that allowed big Uranium to go to Russia, Russian speech....",Tue Mar 28 01:26:04 +0000 2017,26860,,,
General Kelly is doing a great job at the border. Numbers are way down. Many are not even trying to come in anymore.,Mon Mar 27 01:04:42 +0000 2017,20525,,,
"Democrats are smiling in D.C. that the Freedom Caucus, with the help of Club For Growth and Heritage, have saved Planned Parenthood &amp; Ocare!",Sun Mar 26 12:21:58 +0000 2017,14892,,,
