Tweet,Date,Retweets,,,
The Fake News Media will not talk about the importance of the United Nations Security Council's 15-0 vote in favor of sanctions on N. Korea!,Mon Aug 07 20:15:18 +0000 2017,19679,,,
On #PurpleHeartDay💜I thank all the brave men and women who have sacrificed in battle for this GREAT NATION! #USA🇺🇸 ,Mon Aug 07 18:03:42 +0000 2017,15287,,,
"...conquests, how brave he was, and it was all a lie. He cried like a baby and begged for forgiveness like a child. Now he judges collusion?",Mon Aug 07 12:01:20 +0000 2017,16758,,,
Never in U.S.history has anyone lied or defrauded voters like Senator Richard Blumenthal. He told stories about his Vietnam battles and....,Mon Aug 07 11:52:32 +0000 2017,19027,,,
Interesting to watch Senator Richard Blumenthal of Connecticut talking about hoax Russian collusion when he was a  phony Vietnam con artist!,Mon Aug 07 11:47:36 +0000 2017,20204,,,
Working hard from New Jersey while White House goes through long planned renovation. Going to New York next week for more meetings.,Mon Aug 07 11:32:56 +0000 2017,12695,,,
"Hard to believe that with 24/7 #Fake News on CNN, ABC, NBC, CBS, NYTIMES &amp; WAPO, the Trump base is getting stronger!",Mon Aug 07 11:18:05 +0000 2017,16872,,,
"... Supreme Court pick, economic enthusiasm, deregulation &amp; so much more have driven the Trump base even closer together. Will never change!",Mon Aug 07 11:09:36 +0000 2017,14004,,,
"...and West Virginia. The fact is the Fake News Russian collusion story, record Stock Market, border security, military strength, jobs.....",Mon Aug 07 11:04:19 +0000 2017,11606,,,
"The Trump base is far bigger &amp;  stronger than ever before (despite some phony Fake News polling). Look at rallies in Penn, Iowa, Ohio.......",Mon Aug 07 10:58:09 +0000 2017,18845,,,
"The failing @nytimes, which has made every wrong prediction about me including my big election win (apologized), is totally inept!",Mon Aug 07 10:38:32 +0000 2017,13095,,,
Just completed call with President Moon of South Korea. Very happy and impressed with 15-0 United Nations vote on North Korea sanctions.,Mon Aug 07 01:22:08 +0000 2017,19725,,,
"The Fake News refuses to report the success of the first 6 months: S.C., surging economy &amp; jobs,border &amp; military security,ISIS &amp; MS-13 etc.",Mon Aug 07 01:18:08 +0000 2017,22308,,,
RT @IvankaTrump: The Administration is committed to supporting military spouses in the workforce. Thanks Kim for sharing your story! ,Sun Aug 06 22:43:29 +0000 2017,10500,,,
MAKE AMERICA GREAT AGAIN! ,Sun Aug 06 13:15:41 +0000 2017,33316,,,
United Nations Resolution is the single largest economic sanctions package ever on North Korea. Over one billion dollars in cost to N.K.,Sat Aug 05 23:14:18 +0000 2017,17728,,,
Thank you Nicole! ,Sat Aug 05 23:01:05 +0000 2017,10170,,,
"After many years of LEAKS going on in Washington, it is great to see the A.G. taking action! For National Security, the tougher the better!",Sat Aug 05 22:58:17 +0000 2017,21644,,,
The United Nations Security Council just voted 15-0 to sanction North Korea. China and Russia voted with us. Very big financial impact!,Sat Aug 05 22:44:34 +0000 2017,24857,,,
"Working in Bedminster, N.J., as long planned construction is being done at the White House. This is not a vacation - meetings and calls!",Sat Aug 05 22:36:51 +0000 2017,19240,,,
"-@jessebwatters on t…""",Sat Aug 05 22:18:56 +0000 2017,18749,,,
Under Trump," gains against #ISIS have dramatically accelerated""",,,,
",Sat Aug 05 22:12:26 +0000 2017,14276
Prosperity is coming back to our shores because we are putting America WORKERS and FAMILIES first. #AmericaFirst🇺🇸 """,Sat Aug 05 16:00:59 +0000 2017,23140,,,
RT @FoxNews: More than 1 million jobs added since @POTUS took office.  ,Sat Aug 05 11:12:08 +0000 2017,10604,,,
"RT @IvankaTrump: Since @realDonaldTrump inauguration, over 1 million net new jobs have been created in the American economy! #MAGA",Fri Aug 04 23:30:27 +0000 2017,19051,,,
"RT @dcexaminer: Emails show Washington Post, New York Times reporters unenthusiastic about covering Clinton-Lynch meeting ",Fri Aug 04 23:27:36 +0000 2017,10334,,,
Great work being done by @FEMA @DHSgov w/state &amp; local leaders to prepare for hurricane season. Preparedness is an… ,Fri Aug 04 21:38:39 +0000 2017,9858,,,
"No matter the mission, the brave men &amp; women of our @USCG proudly answer the call to serve 24/7/365. THANK YOU and… ",Fri Aug 04 15:48:28 +0000 2017,13924,,,
"RT @paultdove: @FoxBusiness Republican Senators who are opposing the President, look at the great economic news: Americans Are Noticing!",Fri Aug 04 13:21:00 +0000 2017,9169,,,
RT @Bet22325450ste: @FoxBusiness @foxandfriends Come on America. Get on the Trump Train. The winners already have boarded! The losers are w…,Fri Aug 04 13:20:21 +0000 2017,9362,,,
"RT @FoxBusiness: #BreakingNews: U.S. employers added 209,000 jobs in July, unemployment rate down to 4.3% #JobsReport ",Fri Aug 04 13:18:59 +0000 2017,12196,,,
RT @foxandfriends: .@JudgeJeanine: There will be an uproar in this country if they end up with an indictment against a Trump family member…,Fri Aug 04 13:18:38 +0000 2017,11963,,,
RT @RealJamesWoods: I've never witnessed such hatred for a man who is willing to work for free to make his beloved country a better place.…,Fri Aug 04 13:18:21 +0000 2017,56152,,,
Excellent Jobs Numbers just released - and I have only just begun. Many job stifling regulations continue to fall. Movement back to USA!,Fri Aug 04 12:45:50 +0000 2017,18631,,,
"West Virginia was incredible last night. Crowds and enthusiasm were beyond, GDP at 3%, wow!Dem Governor became a Republican last night.",Fri Aug 04 10:35:31 +0000 2017,16620,,,
RT @Team_Trump45: @realDonaldTrump We won. Move on. ,Fri Aug 04 10:29:11 +0000 2017,12421,,,
"Consumer confidence is at a 16 year high....and for good reason. Much more regulation busting"" to come. Working hard on tax cuts &amp; reform!""",Fri Aug 04 10:26:16 +0000 2017,14472,,,
....and don't forget that Foxconn will be spending up to 10 billion dollars on a top of the line plant/plants in Wisconsin.,Fri Aug 04 10:21:34 +0000 2017,10878,,,
Toyota &amp; Mazda to build a new $1.6B plant here in the U.S.A. and create 4K new American jobs. A great investment in American manufacturing!,Fri Aug 04 10:02:24 +0000 2017,25341,,,
"Thank you West Virginia! All across the country, Americans of every kind are coming together w/one simple goal: to… ",Fri Aug 04 04:19:31 +0000 2017,15366,,,
Just arrived in West Virginia for a MAKE AMERICA GREAT AGAIN rally in Huntington at 7:00pmE. Massive crowd expected - tune in! #MAGA🇺🇸,Thu Aug 03 22:52:16 +0000 2017,10423,,,
"Our GREAT VETERANS can now connect w/ their VA healthcare team from anywhere, using #VAVideoConnect - available at:… ",Thu Aug 03 19:07:40 +0000 2017,11463,,,
"Today, I  announced another historic breakthrough for the VA. We are working tirelessly to keep our promises to our… ",Thu Aug 03 18:03:33 +0000 2017,15843,,,
"See you tonight Huntington, West Virginia!
#MakeAmericaGreatAgain🇺🇸
Tickets:  ",Thu Aug 03 16:04:10 +0000 2017,9228,,,
"Our relationship with Russia is at an all-time &amp; very dangerous  low. You can thank Congress, the same people that can't even give us HCare!",Thu Aug 03 12:18:49 +0000 2017,28095,,,
I am continuing to get rid of costly and unnecessary regulations. Much work left to do but effect will be great! Business &amp; jobs will grow.,Thu Aug 03 12:12:21 +0000 2017,19162,,,
Business is looking better than ever with business enthusiasm at record levels. Stock Market at an all-time high. That doesn't just happen!,Thu Aug 03 12:08:54 +0000 2017,15965,,,
"RT @JacobAWohl: @realDonaldTrump The #MAGA great again movement is WINNING, and the left-wing media can't stand it!",Thu Aug 03 12:05:07 +0000 2017,7031,,,
RT @foxandfriends: Insurers seeking huge premium hikes on ObamaCare plans ,Thu Aug 03 12:00:05 +0000 2017,6473,,,
"I love the White House, one of the most beautiful buildings (homes) I have ever seen. But Fake News said I called it a dump - TOTALLY UNTRUE",Thu Aug 03 01:29:46 +0000 2017,31681,,,
I campaigned on creating a merit-based immigration system that protects U.S. workers &amp; taxpayers. Watch:… ,Wed Aug 02 18:29:04 +0000 2017,19632,,,
"Why the Rust Belt just gave Donald Trump a hero's welcome""",,,,,
"Small business owners are the DREAMERS &amp; INNOVATORS who are powering us into the future!
Read more and watch here:… ",Wed Aug 02 13:38:00 +0000 2017,11232,,,
Only the Fake News Media and Trump enemies want me to stop using Social Media (110 million people). Only way for me to get the truth out!,Tue Aug 01 13:55:19 +0000 2017,32538,,,
"Corporations have NEVER made as much money as they are making now."" Thank you Stuart Varney @foxandfriends Jobs are starting to roar","watch!""",Tue Aug 01 13:03:59 +0000 2017,16434,,
"Stock Market could hit all-time high (again) 22,000 today. Was 18,000 only 6 months ago on Election Day. Mainstream media seldom mentions!",Tue Aug 01 12:49:22 +0000 2017,22629,,,
A great day at the White House!,Mon Jul 31 22:19:11 +0000 2017,24209,,,
RT @foxandfriends: .@Suffolk_Sheriff praises President Trump for making gang eradication a priority ,Mon Jul 31 12:29:08 +0000 2017,7530,,,
"Highest Stock Market EVER, best economic numbers in years, unemployment lowest in 17 years, wages raising, border secure, S.C.: No WH chaos!",Mon Jul 31 12:28:00 +0000 2017,29611,,,
"If ObamaCare is hurting people, &amp; it is, why shouldn't it hurt the insurance companies &amp; why should Congress not be paying what public pays?",Mon Jul 31 12:16:46 +0000 2017,34274,,,
"Don't give up Republican Senators, the World is watching: Repeal &amp; Replace...and go to 51 votes (nuke option), get Cross State Lines &amp; more.",Sun Jul 30 11:37:39 +0000 2017,24135,,,
"...they do NOTHING for us with North Korea, just talk. We will no longer allow this to continue. China could easily solve this problem!",Sat Jul 29 23:35:13 +0000 2017,23244,,,
"I am very disappointed in China. Our foolish past leaders have allowed them to make hundreds of billions of dollars a year in trade, yet...",Sat Jul 29 23:29:05 +0000 2017,25562,,,
"I love reading about all of the geniuses"" who were so instrumental in my election success. Problem is  most don't exist. #Fake News! MAGA""",Sat Jul 29 23:15:57 +0000 2017,17736,,,
"Unless the Republican Senators are total quitters, Repeal &amp; Replace is not dead! Demand another vote before voting on any other bill!",Sat Jul 29 20:36:52 +0000 2017,21297,,,
U.S. Stock Market up almost 20% since Election!,Sat Jul 29 17:04:20 +0000 2017,21653,,,
"If a new HealthCare Bill is not approved quickly, BAILOUTS for Insurance Companies and BAILOUTS for Members of Congress will end very soon!",Sat Jul 29 16:27:39 +0000 2017,28559,,,
"After seven years of talking"" Repeal &amp; Replace  the people of our great country are still being forced to live with imploding ObamaCare!""",Sat Jul 29 16:19:12 +0000 2017,18724,,,
"If the Senate Democrats ever got the chance, they would switch to a 51 majority vote in first minute. They are laughing at R's. MAKE CHANGE!",Sat Jul 29 11:47:13 +0000 2017,18145,,,
"....8 Dems totally control the U.S. Senate. Many great Republican bills will never pass, like Kate's Law and complete Healthcare. Get smart!",Sat Jul 29 11:39:25 +0000 2017,17447,,,
Republicans in the Senate will NEVER win if they don't go to a 51 vote majority NOW. They look like fools and are just wasting time......,Sat Jul 29 11:32:52 +0000 2017,17465,,,
"The very outdated filibuster rule must go. Budget reconciliation is killing R's in Senate. Mitch M, go to 51 Votes NOW and WIN. IT'S TIME!",Sat Jul 29 11:28:57 +0000 2017,17180,,,
"Republican Senate must get rid of 60 vote NOW! It is killing the R Party, allows 8 Dems to control country. 200 Bills sit in Senate. A JOKE!",Sat Jul 29 11:20:29 +0000 2017,17887,,,
"In other words, Russia was against Trump in the 2016 Election - and why not, I want strong military &amp; low oil price… ",Sat Jul 29 11:07:18 +0000 2017,18412,,,
"We will defend our country, protect our communities and put the safety of the AMERICAN PEOPLE FIRST! Replay:… ",Sat Jul 29 00:06:26 +0000 2017,14602,,,
I would like to thank Reince Priebus for his service and dedication to his country. We accomplished a lot together and I am proud of him!,Fri Jul 28 21:00:19 +0000 2017,15243,,,
...and a Great Leader. John has also done a spectacular job at Homeland Security. He has been a true star of my Administration,Fri Jul 28 20:54:43 +0000 2017,13984,,,
I am pleased to inform you that I have just named General/Secretary John F Kelly as White House Chief of Staff. He is a Great American....,Fri Jul 28 20:49:51 +0000 2017,23534,,,
Departing for Long Island now. An area under siege from #MS13 gang members. We will not rest until #MS13 is eradica… ,Fri Jul 28 16:24:30 +0000 2017,13242,,,
"We will always ENFORCE our laws, PROTECT our borders, and SUPPORT our police! #LESM
Harrisburg, Pennsylvania… ",Fri Jul 28 16:13:21 +0000 2017,13569,,,
"...Even though parts of healthcare could pass at 51, some really good things need 60. So many great future bills &amp; budgets need 60 votes....",Fri Jul 28 14:00:42 +0000 2017,10692,,,
"If Republicans are going to pass great future legislation in the Senate, they must immediately go to a 51 vote majority, not senseless 60...",Fri Jul 28 13:46:28 +0000 2017,13969,,,
"3 Republicans and 48 Democrats let the American people down. As I said from the beginning, let ObamaCare implode, then deal. Watch!",Fri Jul 28 06:25:33 +0000 2017,26040,,,
"Go Republican Senators, Go! Get there after waiting for 7 years. Give America great healthcare!",Fri Jul 28 02:43:30 +0000 2017,13080,,,
It was my great HONOR to present our nation's highest award for a public safety officer - THE MEDAL OF VALOR to FIV… ,Thu Jul 27 22:49:05 +0000 2017,12855,,,
"Today, we gathered in the East Room to pay tribute to the HEROES whose courageous actions under fire saved so many… ",Thu Jul 27 21:36:51 +0000 2017,12386,,,
Join me live as we recognize the first responders to the June 14th shooting involving @SteveScalise. #TeamScalise… ,Thu Jul 27 19:08:58 +0000 2017,7665,,,
Big progress being made in ridding our country of MS-13 gang members and gang members in general. MAKE AMERICA SAFE AGAIN!,Thu Jul 27 18:37:44 +0000 2017,18740,,,
"...about then candidate Trump. Catherine Herridge @FoxNews. So why doesn't Fake News report this? Witch Hunt! Purposely phony reporting.""",Thu Jul 27 13:45:22 +0000 2017,12039,,,
"One of the things that has been lost in the politics of this situation is that the Russians collected and spread negative information.....""",Thu Jul 27 13:35:35 +0000 2017,12746,,,
"RT @townhallcom: ABC, NBC, And CBS Pretty Much Bury IT Scandal Engulfing Debbie Wasserman Schultz's Office ",Thu Jul 27 12:49:41 +0000 2017,24778,,,
"Come on Republican Senators, you can do it on Healthcare. After 7 years, this is your chance to shine! Don't let the American people down!",Thu Jul 27 11:24:52 +0000 2017,20692,,,
"Wow, the Failing @nytimes said about @foxandfriends ....the most powerful T.V. show in America.""""",Thu Jul 27 10:48:53 +0000 2017,11301,,,
"Thank you Foxconn, for investing $10 BILLION DOLLARS with the potential for up to 13K new jobs in Wisconsin! MadeIn… ",Thu Jul 27 00:01:35 +0000 2017,20583,,,
Congratulations to Boys and Girls Nation. It was my great honor to welcome you to the WH today! Full Remarks:… ,Wed Jul 26 20:54:14 +0000 2017,9712,,,
IN AMERICA WE DON'T WORSHIP GOVERNMENT - WE WORSHIP GOD!🎥,Wed Jul 26 17:21:19 +0000 2017,36744,,,
"...big dollars ($700,000) for his wife's political run from Hillary Clinton and her representatives. Drain the Swamp!",Wed Jul 26 13:52:57 +0000 2017,17501,,,
"Why didn't A.G. Sessions replace Acting FBI Director Andrew McCabe, a Comey friend who was in charge of Clinton investigation but got....",Wed Jul 26 13:48:02 +0000 2017,16394,,,
....victory and cannot be burdened with the tremendous medical costs and disruption that transgender in the military would entail. Thank you,Wed Jul 26 13:08:21 +0000 2017,41037,,,
....Transgender individuals to  serve in any capacity in the U.S. Military. Our military must be focused on decisive and overwhelming.....,Wed Jul 26 13:04:39 +0000 2017,43115,,,
"After consultation with my Generals and military experts, please be advised that the United States Government will not accept or allow......",Wed Jul 26 12:55:58 +0000 2017,41006,,,
"Senator @lisamurkowski of the Great State of Alaska really let the Republicans, and our country, down yesterday. Too bad!",Wed Jul 26 11:13:28 +0000 2017,14099,,,
The crowd in Ohio was amazing last night - broke all records. We all had a great time in a great State. Will be back soon!,Wed Jul 26 10:49:28 +0000 2017,12228,,,
People of Ohio are fantastic. Thank you so much. What an evening! ,Wed Jul 26 04:40:09 +0000 2017,10156,,,
"It was my great honor to join our wonderful Veterans at AMVETS Post 44 in Youngstown, Ohio this evening. A grateful… ",Wed Jul 26 04:05:03 +0000 2017,11734,,,
"Just arrived in Youngstown, Ohio with @FLOTUS Melania!
#MakeAmericaGreatAgain🇺🇸
🎥 ",Tue Jul 25 22:15:50 +0000 2017,8970,,,
.@SenJohnMcCain-Thank you for coming to D.C. for such a vital vote. Congrats to all Rep. We can now deliver grt healthcare to all Americans!,Tue Jul 25 19:24:40 +0000 2017,14021,,,
"Joint Press Conference with Prime Minister Saad Hariri of Lebanon beginning shortly. Join us live!
➡️… ",Tue Jul 25 19:07:42 +0000 2017,4461,,,
The American people have waited long enough. There has been enough talk and no action for seven years. Now is the t… ,Tue Jul 25 15:20:01 +0000 2017,13552,,,
Will be traveling to the Great State of Ohio tonight. Big crowd expected. See you there!,Tue Jul 25 12:29:03 +0000 2017,11824,,,
This will be a very interesting day for HealthCare.The Dems are obstructionists but the Republicans can have a great victory for the people!,Tue Jul 25 12:19:29 +0000 2017,11696,,,
Working on major Trade Deal with the United Kingdom. Could be very big &amp; exciting. JOBS! The E.U. is very protectionist with the U.S. STOP!,Tue Jul 25 12:16:34 +0000 2017,15970,,,
"Jared Kushner did very well yesterday in proving he did not collude with the Russians. Witch Hunt. Next up, 11 year old Barron Trump!",Tue Jul 25 10:52:27 +0000 2017,21679,,,
So great that John McCain is coming back to vote. Brave - American hero! Thank you John.,Tue Jul 25 10:44:06 +0000 2017,21929,,,
ObamaCare is torturing the American People.The Democrats have fooled the people long enough. Repeal or Repeal &amp; Replace! I have pen in hand.,Tue Jul 25 10:38:11 +0000 2017,15882,,,
"Big day for HealthCare. After 7 years of talking, we will soon see whether or not Republicans are willing to step up to the plate!",Tue Jul 25 10:27:47 +0000 2017,13406,,,
"Problem is that the acting head of the FBI &amp; the person in charge of the Hillary investigation, Andrew McCabe, got $700,000 from H for wife!",Tue Jul 25 10:21:41 +0000 2017,22756,,,
Attorney General Jeff Sessions has taken a VERY weak position on Hillary Clinton crimes (where are E-mails &amp; DNC server) &amp; Intel leakers!,Tue Jul 25 10:12:24 +0000 2017,19379,,,
"Ukrainian efforts to sabotage Trump campaign - quietly working to boost Clinton."" So where is the investigation A.G. @seanhannity""",Tue Jul 25 10:03:33 +0000 2017,16948,,,
Is Fake News Washington Post being used as a lobbyist weapon against Congress to keep Politicians from looking into Amazon no-tax monopoly?,Tue Jul 25 02:36:17 +0000 2017,16675,,,
So many stories about me in the @washingtonpost are Fake News. They are as bad as ratings challenged @CNN. Lobbyist for Amazon and taxes?,Tue Jul 25 02:28:44 +0000 2017,12839,,,
"The Amazon Washington Post fabricated the facts on my ending massive, dangerous, and wasteful payments to Syrian rebels fighting Assad.....",Tue Jul 25 02:23:18 +0000 2017,14869,,,
#2017Jambo- Remember your duty. Honor your history. Take care of the people God puts into your life – and LOVE &amp; CH… ,Tue Jul 25 01:13:42 +0000 2017,19164,,,
"Any senator who votes against starting debate is telling America that you are fine w/ the #OCareNightmare! 
Remarks… ",Mon Jul 24 21:33:25 +0000 2017,11385,,,
"Arriving at Joint Base Andrews with @SecretaryPerry, @SecretaryZinke, and @SecPriceMD..... ",Mon Jul 24 20:15:25 +0000 2017,10332,,,
Republicans have a last chance to do the right thing on Repeal &amp; Replace after years of talking &amp; campaigning on it.,Mon Jul 24 13:18:07 +0000 2017,19190,,,
"Sleazy Adam Schiff, the totally biased Congressman looking into Russia", spends all of his time on television pushing the Dem loss excuse!,Mon Jul 24 13:12:59 +0000 2017,20616,,
"So why aren't the Committees and investigators, and of course our beleaguered A.G., looking into Crooked Hillarys crimes &amp; Russia relations?",Mon Jul 24 12:49:38 +0000 2017,24490,,,
"After 1 year of investigation with Zero evidence being found, Chuck Schumer just stated that Democrats should blame ourselves","not Russia.""""",Mon Jul 24 10:52:39 +0000 2017,27718,,
"Drain the Swamp should be changed to Drain the Sewer - it's actually much worse than anyone ever thought, and it begins with the Fake News!",Mon Jul 24 10:40:28 +0000 2017,31961,,,
"Thank you to @LOUDOBBS for giving the first six months of the Trump Administration an A+. S.C.,reg cutting,Stock M, jobs,border etc. = TRUE!",Mon Jul 24 00:23:40 +0000 2017,19731,,,
"If Republicans don't Repeal and Replace the disastrous ObamaCare, the repercussions will be far greater than any of them understand!",Mon Jul 24 00:01:47 +0000 2017,21448,,,
"It's hard to read the Failing New York Times or the Amazon Washington Post because every story/opinion, even if should be positive, is bad!",Sun Jul 23 23:57:36 +0000 2017,15048,,,
"It's very sad that Republicans, even some that were carried over the line on my back, do very little to protect their President.",Sun Jul 23 20:14:32 +0000 2017,33892,,,
"As the phony Russian Witch Hunt continues, two groups are laughing at this excuse for a lost election taking hold, Democrats and Russians!",Sun Jul 23 20:09:05 +0000 2017,19357,,,
"To every PATRIOT who will serve on the #USSGeraldRFord:
☑️Keep the watch🇺🇸
☑️Protect her🇺🇸
☑️Defend her🇺🇸
☑️LOVE HE… ",Sun Jul 23 00:50:17 +0000 2017,26388,,,
"American steel &amp; American hands have constructed a 100,000 ton message to the world: American MIGHT IS SECOND TO NO… ",Sat Jul 22 22:57:01 +0000 2017,12899,,,
A ship is only as good as the people who serve on it — and the AMERICAN SAILOR is the BEST in the world. @USNavy… ,Sat Jul 22 19:22:35 +0000 2017,16199,,,
"Join me live for the commissioning ceremony of the USS Gerald R. Ford!
➡️ #USA ",Sat Jul 22 14:43:18 +0000 2017,8270,,,
"ObamaCare is dead and the Democrats are obstructionists, no ideas or votes, only obstruction. It is solely up to the 52 Republican Senators!",Sat Jul 22 12:23:30 +0000 2017,19684,,,
"The Republican Senators must step up to the plate and, after 7 years, vote to Repeal and Replace. Next, Tax Reform and Infrastructure. WIN!",Sat Jul 22 12:17:54 +0000 2017,19015,,,
"In all fairness to Anthony Scaramucci, he wanted to endorse me 1st, before the Republican Primaries started, but didn't think I was running!",Sat Jul 22 12:10:41 +0000 2017,10786,,,
"My son Donald openly gave his e-mails to the media &amp; authorities whereas Crooked Hillary Clinton deleted (&amp; acid washed) her 33,000 e-mails!",Sat Jul 22 12:00:30 +0000 2017,26358,,,
"...What about all of the Clinton ties to Russia, including Podesta Company, Uranium deal, Russian Reset, big dollar speeches etc.",Sat Jul 22 11:47:53 +0000 2017,24210,,,
"So many people are asking why isn't the A.G. or Special Council looking at the many Hillary Clinton or Comey crimes. 33,000 e-mails deleted?",Sat Jul 22 11:44:29 +0000 2017,28474,,,
"While all agree the U. S. President has the complete power to pardon, why think of that when only crime so far is LEAKS against us.FAKE NEWS",Sat Jul 22 11:35:34 +0000 2017,16862,,,
"This morning I will be going to the Commissioning Ceremony for the largest aircraft carrier in the world, The Gerald R. Ford.  Norfolk, Va.",Sat Jul 22 10:52:00 +0000 2017,11746,,,
"The Failing New York Times foiled U.S. attempt to kill the single most wanted terrorist,Al-Baghdadi.Their sick agenda over National Security",Sat Jul 22 10:45:05 +0000 2017,19731,,,
"A new INTELLIGENCE LEAK from the Amazon Washington Post,this time against A.G. Jeff Sessions.These illegal leaks, like Comey's, must stop!",Sat Jul 22 10:33:01 +0000 2017,18536,,,
Sean Spicer is a wonderful person who took tremendous abuse from the Fake News Media - but his future is bright!,Sat Jul 22 01:46:33 +0000 2017,22140,,,
"Today, it was my privilege to welcome survivors of the #USSArizona to the @WhiteHouse. #HonorThem🇺🇸
Remarks:… ",Fri Jul 21 22:47:40 +0000 2017,14560,,,
Manufacturers’ record-high optimism reported in the 1st qtr has carried into the 2nd qtr of 2017 via @ShopFloorNAM:… ,Fri Jul 21 19:19:56 +0000 2017,9908,,,
"ICYMI- This week we hosted a #MadeInAmerica event, right here at the @WhiteHouse! If it is MADE IN AMERICA, it is t… ",Fri Jul 21 16:06:04 +0000 2017,12618,,,
"Six months in - it is the hope of GROWTH📈that is making America🇺🇸FOUR TRILLION DOLLARS💰RICHER."" -Stuart @VarneyCo… """,Fri Jul 21 15:28:38 +0000 2017,15117,,,
"#MadeInAmerica🇺🇸
📸 ",Fri Jul 21 13:41:01 +0000 2017,8750,,,
"Billions of dollars in investments &amp; thousands of new jobs in America! An initiative via Corning, Merck &amp; Pfizer:… ",Fri Jul 21 03:31:45 +0000 2017,13434,,,
"I am asking all citizens to believe in yourselves, believe in your future, and believe, once more, in America.… ",Thu Jul 20 20:08:58 +0000 2017,34526,,,
